{
  "offering": {
    "id": "offering:1",
    "term_id": "term:1",
    "section": "A",
    "course": {
      "id": "course:1",
      "code": "CS201",
      "title": "Synthetic Course",
      "credits": 4,
      "type": "theory"
    }
  },
  "framework": {
    "code": "nba-ug-eng",
    "version": "gapc-v4.0",
    "outcome_count": 11,
    "supersedes": "gapc-v3.0"
  },
  "course_outcomes": [
    {
      "id": "co:CO1",
      "code": "CO1",
      "statement": "CO1 — synthetic course outcome.",
      "sequence": 1
    },
    {
      "id": "co:CO2",
      "code": "CO2",
      "statement": "CO2 — synthetic course outcome.",
      "sequence": 2
    },
    {
      "id": "co:CO3",
      "code": "CO3",
      "statement": "CO3 — synthetic course outcome.",
      "sequence": 3
    }
  ],
  "outcomes": [
    {
      "id": "outcome:PO1",
      "code": "PO1",
      "kind": "po",
      "statement": "PO1 — synthetic programme outcome.",
      "sequence": 1
    }
  ],
  "articulation": [
    {
      "course_outcome_id": "co:CO1",
      "outcome_id": "outcome:PO1",
      "correlation": 3,
      "justification": "CO1 is assessed through work requiring PO1-level capability."
    },
    {
      "course_outcome_id": "co:CO2",
      "outcome_id": "outcome:PO1",
      "correlation": 2,
      "justification": "CO2 is assessed through work requiring PO1-level capability."
    },
    {
      "course_outcome_id": "co:CO3",
      "outcome_id": "outcome:PO1",
      "correlation": 2,
      "justification": "CO3 is assessed through work requiring PO1-level capability."
    }
  ],
  "assessments": [
    {
      "id": "M1",
      "name": "Mid-semester 1",
      "kind": "cie",
      "max_marks": 20,
      "weight_pct": 1,
      "group_id": "M"
    },
    {
      "id": "M2",
      "name": "Mid-semester 2",
      "kind": "cie",
      "max_marks": 10,
      "weight_pct": 1,
      "group_id": "M"
    }
  ],
  "questions": [
    {
      "id": "M1:Q1",
      "assessment_id": "M1",
      "label": "Q1",
      "max_marks": 10,
      "sequence": 1
    },
    {
      "id": "M1:Q3",
      "assessment_id": "M1",
      "label": "Q3",
      "max_marks": 10,
      "sequence": 2,
      "choice_group": "either"
    },
    {
      "id": "M1:Q4",
      "assessment_id": "M1",
      "label": "Q4",
      "max_marks": 10,
      "sequence": 3,
      "choice_group": "either"
    },
    {
      "id": "M2:Q1",
      "assessment_id": "M2",
      "label": "Q1",
      "max_marks": 10,
      "sequence": 1
    }
  ],
  "question_outcomes": [
    {
      "question_id": "M1:Q1",
      "course_outcome_id": "co:CO1",
      "weight": 1
    },
    {
      "question_id": "M1:Q3",
      "course_outcome_id": "co:CO2",
      "weight": 1
    },
    {
      "question_id": "M1:Q4",
      "course_outcome_id": "co:CO3",
      "weight": 1
    },
    {
      "question_id": "M2:Q1",
      "course_outcome_id": "co:CO1",
      "weight": 1
    }
  ],
  "enrollments": [
    {
      "id": "en:S1",
      "student_id": "st:S1",
      "roll_no": "S1",
      "display_name": "Student S1",
      "status": "active"
    },
    {
      "id": "en:S2",
      "student_id": "st:S2",
      "roll_no": "S2",
      "display_name": "Student S2",
      "status": "active"
    },
    {
      "id": "en:S3",
      "student_id": "st:S3",
      "roll_no": "S3",
      "display_name": "Student S3",
      "status": "active"
    },
    {
      "id": "en:S4",
      "student_id": "st:S4",
      "roll_no": "S4",
      "display_name": "Student S4",
      "status": "active"
    }
  ],
  "marks": [
    {
      "enrollment_id": "en:S1",
      "question_id": "M1:Q1",
      "score": 9,
      "attempted": true
    },
    {
      "enrollment_id": "en:S1",
      "question_id": "M1:Q3",
      "score": 8,
      "attempted": true
    },
    {
      "enrollment_id": "en:S1",
      "question_id": "M1:Q4",
      "score": 0,
      "attempted": false
    },
    {
      "enrollment_id": "en:S1",
      "question_id": "M2:Q1",
      "score": 7,
      "attempted": true
    },
    {
      "enrollment_id": "en:S2",
      "question_id": "M1:Q1",
      "score": 6,
      "attempted": true
    },
    {
      "enrollment_id": "en:S2",
      "question_id": "M1:Q3",
      "score": 0,
      "attempted": false
    },
    {
      "enrollment_id": "en:S2",
      "question_id": "M1:Q4",
      "score": 7,
      "attempted": true
    },
    {
      "enrollment_id": "en:S2",
      "question_id": "M2:Q1",
      "score": 8,
      "attempted": true
    },
    {
      "enrollment_id": "en:S3",
      "question_id": "M1:Q1",
      "score": 5,
      "attempted": true
    },
    {
      "enrollment_id": "en:S3",
      "question_id": "M1:Q3",
      "score": 4,
      "attempted": true
    },
    {
      "enrollment_id": "en:S3",
      "question_id": "M1:Q4",
      "score": 0,
      "attempted": false
    },
    {
      "enrollment_id": "en:S3",
      "question_id": "M2:Q1",
      "score": 4,
      "attempted": true
    },
    {
      "enrollment_id": "en:S4",
      "question_id": "M1:Q1",
      "score": 7,
      "attempted": true
    },
    {
      "enrollment_id": "en:S4",
      "question_id": "M1:Q3",
      "score": 0,
      "attempted": false
    },
    {
      "enrollment_id": "en:S4",
      "question_id": "M1:Q4",
      "score": 9,
      "attempted": true
    },
    {
      "enrollment_id": "en:S4",
      "question_id": "M2:Q1",
      "score": 9,
      "attempted": true
    }
  ],
  "assessment_totals": [],
  "assessment_groups": [
    {
      "id": "M",
      "name": "Mid-semesters",
      "weight_pct": 100,
      "selection_rule": "best_n",
      "n": 1
    }
  ],
  "choice_groups": [
    {
      "id": "either",
      "assessment_id": "M1",
      "required": 1
    }
  ]
}
