{
  "offering": {
    "id": "offering:1",
    "term_id": "term:1",
    "section": "A",
    "course": {
      "id": "course:1",
      "code": "CS201",
      "title": "Synthetic Course",
      "credits": 4,
      "type": "theory"
    },
    "see_mode": "blueprint_uniform"
  },
  "framework": {
    "code": "nba-ug-eng",
    "version": "gapc-v4.0",
    "outcome_count": 11,
    "supersedes": "gapc-v3.0"
  },
  "course_outcomes": [
    {
      "id": "co:CO1",
      "code": "CO1",
      "statement": "CO1 — synthetic course outcome.",
      "sequence": 1
    },
    {
      "id": "co:CO2",
      "code": "CO2",
      "statement": "CO2 — synthetic course outcome.",
      "sequence": 2
    }
  ],
  "outcomes": [
    {
      "id": "outcome:PO1",
      "code": "PO1",
      "kind": "po",
      "statement": "PO1 — synthetic programme outcome.",
      "sequence": 1
    }
  ],
  "articulation": [
    {
      "course_outcome_id": "co:CO1",
      "outcome_id": "outcome:PO1",
      "correlation": 3,
      "justification": "CO1 is assessed through work requiring PO1-level capability."
    },
    {
      "course_outcome_id": "co:CO2",
      "outcome_id": "outcome:PO1",
      "correlation": 2,
      "justification": "CO2 is assessed through work requiring PO1-level capability."
    }
  ],
  "assessments": [
    {
      "id": "CIE",
      "name": "Internal assessment",
      "kind": "cie",
      "max_marks": 20,
      "weight_pct": 25
    },
    {
      "id": "SEE",
      "name": "University end-semester examination",
      "kind": "see",
      "max_marks": 40,
      "weight_pct": 75
    }
  ],
  "questions": [
    {
      "id": "CIE:Q1",
      "assessment_id": "CIE",
      "label": "Q1",
      "max_marks": 10,
      "sequence": 1
    },
    {
      "id": "CIE:Q2",
      "assessment_id": "CIE",
      "label": "Q2",
      "max_marks": 10,
      "sequence": 2
    }
  ],
  "question_outcomes": [
    {
      "question_id": "CIE:Q1",
      "course_outcome_id": "co:CO1",
      "weight": 1
    },
    {
      "question_id": "CIE:Q2",
      "course_outcome_id": "co:CO2",
      "weight": 1
    }
  ],
  "enrollments": [
    {
      "id": "en:S1",
      "student_id": "st:S1",
      "roll_no": "S1",
      "display_name": "Student S1",
      "status": "active"
    },
    {
      "id": "en:S2",
      "student_id": "st:S2",
      "roll_no": "S2",
      "display_name": "Student S2",
      "status": "active"
    },
    {
      "id": "en:S3",
      "student_id": "st:S3",
      "roll_no": "S3",
      "display_name": "Student S3",
      "status": "active"
    },
    {
      "id": "en:S4",
      "student_id": "st:S4",
      "roll_no": "S4",
      "display_name": "Student S4",
      "status": "active"
    },
    {
      "id": "en:S5",
      "student_id": "st:S5",
      "roll_no": "S5",
      "display_name": "Student S5",
      "status": "active"
    }
  ],
  "marks": [
    {
      "enrollment_id": "en:S1",
      "question_id": "CIE:Q1",
      "score": 8,
      "attempted": true
    },
    {
      "enrollment_id": "en:S1",
      "question_id": "CIE:Q2",
      "score": 7,
      "attempted": true
    },
    {
      "enrollment_id": "en:S2",
      "question_id": "CIE:Q1",
      "score": 6,
      "attempted": true
    },
    {
      "enrollment_id": "en:S2",
      "question_id": "CIE:Q2",
      "score": 6,
      "attempted": true
    },
    {
      "enrollment_id": "en:S3",
      "question_id": "CIE:Q1",
      "score": 4,
      "attempted": true
    },
    {
      "enrollment_id": "en:S3",
      "question_id": "CIE:Q2",
      "score": 4,
      "attempted": true
    },
    {
      "enrollment_id": "en:S4",
      "question_id": "CIE:Q1",
      "score": 9,
      "attempted": true
    },
    {
      "enrollment_id": "en:S4",
      "question_id": "CIE:Q2",
      "score": 8,
      "attempted": true
    },
    {
      "enrollment_id": "en:S5",
      "question_id": "CIE:Q1",
      "score": 5,
      "attempted": true
    },
    {
      "enrollment_id": "en:S5",
      "question_id": "CIE:Q2",
      "score": 5,
      "attempted": true
    }
  ],
  "assessment_totals": [
    {
      "enrollment_id": "en:S1",
      "assessment_id": "SEE",
      "total_score": 30
    },
    {
      "enrollment_id": "en:S2",
      "assessment_id": "SEE",
      "total_score": 24
    },
    {
      "enrollment_id": "en:S3",
      "assessment_id": "SEE",
      "total_score": 18
    },
    {
      "enrollment_id": "en:S4",
      "assessment_id": "SEE",
      "total_score": 36
    },
    {
      "enrollment_id": "en:S5",
      "assessment_id": "SEE",
      "total_score": 20
    }
  ],
  "see_blueprint": {
    "assessment_id": "SEE",
    "distribution": [
      {
        "course_outcome_id": "co:CO1",
        "marks": 25
      },
      {
        "course_outcome_id": "co:CO2",
        "marks": 15
      }
    ]
  }
}
